{
  "name": "Field mini",
  "device": {
    "model": "streamdeck-mini",
    "rows": 2,
    "cols": 3,
    "key_px": 72
  },
  "matrix": "LOND",
  "port": 59,
  "api": "http://127.0.0.1:8180",
  "name_on_matrix": "Stream Deck Mini (FLD01)",
  "buttons": [
    {
      "row": 0,
      "col": 0,
      "label": "DIR",
      "action": "talk",
      "target": "PNL01"
    },
    {
      "row": 0,
      "col": 1,
      "label": "PROD",
      "action": "talk",
      "target": "PNL03"
    },
    {
      "row": 0,
      "col": 2,
      "label": "REPLY",
      "action": "reply",
      "colors": {
        "idle": "#1f3b57"
      }
    },
    {
      "row": 1,
      "col": 0,
      "label": "AUDIO",
      "action": "talk",
      "target": "AUD01"
    },
    {
      "row": 1,
      "col": 1,
      "label": "MON\nIFB1",
      "action": "listen",
      "target": "IFB01",
      "mode": "latch",
      "colors": {
        "active": "#2e9e4f"
      }
    },
    {
      "row": 1,
      "col": 2,
      "label": "HOME\nPARIS",
      "action": "call",
      "target": "PARI:3",
      "mode": "latch",
      "colors": {
        "idle": "#3a2a5a"
      }
    }
  ]
}
