{
  "name": "Audio position Plus",
  "device": {
    "model": "streamdeck-plus",
    "rows": 2,
    "cols": 4,
    "key_px": 120,
    "encoders": 4
  },
  "matrix": "LOND",
  "port": 43,
  "api": "http://127.0.0.1:8180",
  "name_on_matrix": "Stream Deck Plus (AUD01)",
  "buttons": [
    {
      "row": 0,
      "col": 0,
      "label": "DIR",
      "action": "talk",
      "target": "PNL01"
    },
    {
      "row": 0,
      "col": 1,
      "label": "TD",
      "action": "talk",
      "target": "PNL02"
    },
    {
      "row": 0,
      "col": 2,
      "label": "IFB 1",
      "action": "talk",
      "target": "IFB01"
    },
    {
      "row": 0,
      "col": 3,
      "label": "REPLY",
      "action": "reply",
      "colors": {
        "idle": "#1f3b57"
      }
    },
    {
      "row": 1,
      "col": 0,
      "label": "FIELD 1",
      "action": "talk",
      "target": "FLD01"
    },
    {
      "row": 1,
      "col": 1,
      "label": "FIELD 2",
      "action": "talk",
      "target": "FLD02"
    },
    {
      "row": 1,
      "col": 2,
      "label": "MON\nIFB1",
      "action": "listen",
      "target": "IFB01",
      "mode": "latch",
      "colors": {
        "active": "#2e9e4f"
      }
    },
    {
      "row": 1,
      "col": 3,
      "label": "MON\nWLS1",
      "action": "listen",
      "target": "WLS01",
      "mode": "latch",
      "colors": {
        "active": "#2e9e4f"
      }
    }
  ],
  "encoders": [
    {
      "index": 0,
      "label": "IFB1 level",
      "action": "listen_level",
      "target": "IFB01"
    },
    {
      "index": 1,
      "label": "WLS1 level",
      "action": "listen_level",
      "target": "WLS01"
    },
    {
      "index": 2,
      "label": "mic",
      "action": "mic_level"
    },
    {
      "index": 3,
      "label": "targets",
      "action": "scroll_targets"
    }
  ]
}
